{"artifacts":[{"relative_path":"data/release/v1.2/enrichment_provenance.parquet","row_count":1008,"schema_path":"schemas/movie.schema.json","sha256":"4d985b1319bf1fc9b415cbc779fdbfde8274aa806d669701a867f887d9c5cf37","size_bytes":37002},{"relative_path":"data/release/v1.2/movie_tiers.parquet","row_count":4658,"schema_path":"schemas/movie.schema.json","sha256":"d9bb0ddd8ab7269bb9b3948be7e34f4a032dc2fe7d59a134df02b5b2ff3c4256","size_bytes":43739},{"relative_path":"data/release/v1.2/movies.csv","row_count":4658,"schema_path":"schemas/movie.schema.json","sha256":"a5b74bf12693ff104759d0d54ee2d7f3beaf0a07337862627862ce3e7aa205b5","size_bytes":959943},{"relative_path":"data/release/v1.2/movies.parquet","row_count":4658,"schema_path":"schemas/movie.schema.json","sha256":"c3f7b30a6305dec7f2cabca1397974012fc8dcfba9ee96ec69fe385dfdd3a58f","size_bytes":297665},{"relative_path":"data/release/v1.2/pilot_movies.parquet","row_count":24,"schema_path":"schemas/movie.schema.json","sha256":"ad2e8cf500a70f2f2d8e063aacb6ea26643d75268046de8ce2076e54fdd07565","size_bytes":3168},{"relative_path":"data/release/v1.2/poster_manifest.parquet","row_count":4658,"schema_path":"schemas/media_asset.schema.json","sha256":"db08e8cf15ab97f7ac33134cb6b34af50dc0ff371d001ad5a3edc63bce1d5c78","size_bytes":330150}],"expected_counts":{"audit_rows":1008,"pilot_movies":24,"quarantine_movies":1264,"release_movies":4658,"tier_counts":{"A":313,"B":4295,"S":50}},"poster_state_counts":{"content_conflict":73,"machine_passed":4545,"missing":31,"placeholder":9},"release_version":"v1.2","source_generated_at":"2026-07-17T04:08:41.762998+00:00","source_manifest_sha256":"cbd529e126e8b72dccac302d9746fcfa63318caecbcda24548c05e282e13f974"}
